{
  "$schema": "../../../references/recipe.schema.json",
  "version": 1,
  "artifact": {
    "title": "Build Notes",
    "description": "A deterministic Markdown Recipe example",
    "favicon": "📝",
    "format": "markdown",
    "level": 1,
    "canvas": false,
    "channel": null,
    "scope": "Recipe builder Markdown example",
    "watch": [],
    "local": false,
    "autoUpdate": false
  },
  "document": {
    "language": "en",
    "theme": "viewer-default",
    "fragments": {
      "theme": [],
      "styles": [],
      "body": ["fragments/body.md"],
      "scripts": []
    }
  },
  "security": {
    "encrypted": false,
    "passwordCredential": null
  },
  "build": {
    "strategy": "auto"
  }
}
