{
  "$schema": "../../skills/using-open-artifacts/references/recipe.schema.json",
  "version": 1,
  "artifact": {
    "title": "Pixel Grid Editor",
    "description": "An interactive pixel-art grid editor: paint, erase, flood-fill, and eyedrop on an 8x8 / 16x16 / 32x32 canvas, with undo/redo, gridline toggle, live 1:1 preview, and PNG export. Quiet systems-grade chrome, single accent, both themes.",
    "favicon": "🎨",
    "format": "html",
    "level": 2,
    "canvas": false,
    "channel": null,
    "scope": "Interactive pixel-art grid editor (Level 2). Paint / Erase / Fill / Eyedropper tools, 8x8 / 16x16 / 32x32 grid sizes, curated 16-swatch palette, undo/redo history, clear, gridline toggle, live 1:1 preview, Copy/Download PNG. Keyboard-first (P/E/G/I, Ctrl/Cmd+Z, Ctrl/Cmd+Shift+Z). Tech/utility direction, restrained chrome, both themes, strict inline CSP.",
    "watch": [],
    "local": false,
    "autoUpdate": false
  },
  "document": {
    "language": "en",
    "theme": "pixel-editor-tech-utility",
    "fragments": {
      "theme": ["../fragments/pixel-grid-editor/theme.css"],
      "body": ["../fragments/pixel-grid-editor/body.html"],
      "scripts": ["../fragments/pixel-grid-editor/behavior.js"]
    }
  },
  "security": {
    "encrypted": false,
    "passwordCredential": null
  },
  "build": {
    "strategy": "auto"
  }
}
