{
  "$schema": "../../../references/recipe.schema.json",
  "version": 1,
  "artifact": {
    "title": "Release Readiness",
    "description": "A deterministic document Recipe example",
    "favicon": "🚦",
    "format": "html",
    "level": 1,
    "canvas": false,
    "channel": null,
    "scope": "Recipe builder document example",
    "watch": [],
    "local": false,
    "autoUpdate": false
  },
  "document": {
    "language": "en",
    "theme": "editorial-status",
    "fragments": {
      "theme": ["fragments/theme.css"],
      "styles": ["fragments/report.css"],
      "body": ["fragments/body.html"],
      "scripts": []
    }
  },
  "security": {
    "encrypted": false,
    "passwordCredential": null
  },
  "build": {
    "strategy": "auto"
  }
}
